{"schema":"capability/v0.1","name":"@ywj/postgresql-query-reviewer","version":"0.1.0","description":"Deterministic, read-only heuristic review of PostgreSQL SQL.","license":"MIT","content":{"files":["knowledge/heuristics.md","skills/review.md","evals/golden.json","policies/permissions.json","evidence/README.md","tools/README.md","CHANGELOG.md"]},"permissions":{"network":"none","filesystem":"workspace-read","database":"read-only-no-execution","shell":"none"},"compatibility":{"codex":"local-v1","postgresql":["16","17","18"]},"provenance":{"source":"local-example","author":"ywj","createdAt":"2026-09-16"},"eval":{"contract":"deterministic-frozen-sql-review-v1","cases":"evals/golden.json"}}
